site,country,title,price_usd,review_count,seller_badge,search_position,monthly_sold_count,is_bestseller,bestseller_rank,validity,usage_validity,activation_validity,network_type,network_generation,carrier_support_local,data_amount,product_url,asin,site_product_id,seller,brand,evidence
amazon_us,kr,"USA Prepaid eSIM 25GB 30Days Data Plan | Get QR Code Instantly | 5G/4G High-Speed | Supports Hotspot | Easy Setup | Data Only for Travel, Business – No Contract for Unlocked iOS & Android",24.35,33,,,,True,94,30일,30일,180일,unknown,lte_4g_only,"{""skt"": null, ""kt"": null, ""lgu"": null}",25GB,https://www.amazon.com/25GB-30Days-Instantly-High-Speed-Supports/dp/B0GTLZ5L1D,B0GTLZ5L1D,B0GTLZ5L1D,STAR VENTURE,Visit the generic Store,"{""price_usd"": [""$24.35""], ""usage_validity"": [""USA Prepaid eSIM 25GB 30Days Data Plan | Get QR Code Instantly | 5G/4G High-Speed | Supports Hotspot | Easy Setup | Data Only for Travel, Business – No Contract for Unlocked iOS & ""], ""activation_validity"": [""KiwiSIM USA Data SIM Card 12GB 180 Days, 4G LTE SIM Card Support for AT&T, T-Mobile and Verizon, Nano Card for Unlocked Cellular Security Cameras/Router/Hotspot WiFi/Trail Camera (""], ""data_amount"": [""25GB 30-Day Prepaid eSIM — Get 25GB of high-speed 5G/4G LTE coverage nationwide across the USA for 30 days. Ideal for travelers and business professionals: supports mobile hotspot ""], ""network_type"": [""insufficient_or_conflicting_signals(local=0, roaming=-2)""], ""network_generation"": [""product_info_cellular_4g_lte: source:product_info_cellular: Cellular Technology LTE"", ""product_info_cellular_4g_lte: source:product_info_cellular: Cellular Technology LTE""], ""review_count"": [""detail_page: 33 global ratings""], ""is_bestseller"": [""Best Sellers Rank #42,793 in Cell Phones & Accessories ( See Top 100 in Cell Phones & Accessories ) #94 in Cell Phone SIM Cards""], ""bestseller_rank"": [""Best Sellers Rank #42,793 in Cell Phones & Accessories ( See Top 100 in Cell Phones & Accessories ) #94 in Cell Phone SIM Cards""], ""title"": [""USA Prepaid eSIM 25GB 30Days Data Plan | Get QR Code Instantly | 5G/4G High-Speed | Supports Hotspot | Easy Setup | Data Only for Travel, Business – No Contract for Unlocked iOS & Android""]}"
amazon_us,kr,Peru 7-Day | 1GB Fixed Data eSIM,15.99,25,,,,True,200,7일,7일,30일,roaming,unknown,"{""skt"": null, ""kt"": null, ""lgu"": null}",1GB,https://www.amazon.com/Peru-7-Day-1GB-Fixed-Data/dp/B0G8NJ9FD4,B0G8NJ9FD4,B0G8NJ9FD4,Jethro Trading Ltd.,Visit the JETSIM Store,"{""price_usd"": [""$15.99""], ""usage_validity"": [""Peru 7-Day | 1GB Fixed Data eSIM""], ""activation_validity"": [""Product description Can I use my eSIM immediately after purchase? Yes. Simply submit the claim form, and we will deliver your eSIM to your email right away. Do I need to activate m""], ""data_amount"": [""[Fast & Reliable Data] 1GB high-speed + unlimited basic data for 7 days. Perfect for maps, apps, and staying connected in Peru.""], ""network_type"": [""Product description Can I use my eSIM immediately after purchase? Yes. Simply submit the claim form, and we will deliver your eSIM to your email right away. Do I need to activate m"", ""score: local=0, roaming=3""], ""network_generation"": [""fallback_5g: source:image_alt: Data Only SIM Card with 1GB Trial, 5G/4G LTE for Mobile WiFi Hotspot, Router, Table..."", ""fallback_4g_lte: source:image_alt: Data Only SIM Card with 1GB Trial, 5G/4G LTE for Mobile WiFi Hotspot, Router, Table..."", ""fallback_only_network_generation_signal""], ""review_count"": [""detail_page: 25""], ""is_bestseller"": [""Best Sellers Rank #86,675 in Cell Phones & Accessories ( See Top 100 in Cell Phones & Accessories ) #200 in Cell Phone SIM Cards""], ""bestseller_rank"": [""Best Sellers Rank #86,675 in Cell Phones & Accessories ( See Top 100 in Cell Phones & Accessories ) #200 in Cell Phone SIM Cards""], ""title"": [""Peru 7-Day | 1GB Fixed Data eSIM""]}"
amazon_us,kr,"Dominican Republic Travel eSIM (30-Day) - 5GB High-Speed Data, Use with iPhones, Androids & eSIM Compatible Phones, No Physical SIM Card Required",40.84,90,,,,True,653,30일,30일,30일,unknown,5g_capable,"{""skt"": null, ""kt"": null, ""lgu"": null}",5GB,https://www.amazon.com/Dominican-Republic-Travel-eSIM-30-Day/dp/B0GM2SF7VQ,B0GM2SF7VQ,B0GM2SF7VQ,Jethro Trading Ltd.,Visit the JETSIM Store,"{""price_usd"": [""$40.84""], ""usage_validity"": [""Dominican Republic Travel eSIM (30-Day) - 5GB High-Speed Data, Use with iPhones, Androids & eSIM Compatible Phones, No Physical SIM Card Required""], ""activation_validity"": [""Product description Can I use my eSIM immediately after purchase? Yes. Simply submit the claim form, and we will deliver your eSIM to your email right away. Do I need to activate m""], ""data_amount"": [""[Fast & Reliable Data] 5GB at high-speed + unlimited basic data for 30 days - ideal for maps, social media, and emails.""], ""network_type"": [""local_signal: [Instant Activation] Connects automatically with local carriers when you arrive in the Dominican Republic. No SIM swapping, no setup—just scan and go."", ""roaming_signal: Product description Can I use my eSIM immediately after purchase? Yes. Simply submit the claim form, and we will deliver your eSIM to your email right away. Do I need to activate m"", ""insufficient_or_conflicting_signals(local=3, roaming=3)""], ""network_generation"": [""product_info_cellular_5g: source:product_info_cellular: Cellular Technology 5G"", ""product_info_cellular_5g: source:product_info_cellular: Cellular Technology 5G""], ""review_count"": [""detail_page: 90""], ""is_bestseller"": [""Best Sellers Rank #291,394 in Cell Phones & Accessories ( See Top 100 in Cell Phones & Accessories ) #653 in Cell Phone SIM Cards""], ""bestseller_rank"": [""Best Sellers Rank #291,394 in Cell Phones & Accessories ( See Top 100 in Cell Phones & Accessories ) #653 in Cell Phone SIM Cards""], ""title"": [""Dominican Republic Travel eSIM (30-Day) - 5GB High-Speed Data, Use with iPhones, Androids & eSIM Compatible Phones, No Physical SIM Card Required""]}"
amazon_us,kr,"Prepaid eSIM for Mainland China, Hong Kong, Macau, Taiwan | 20GB 30Day Plan Data | Get QR Code Instantly | 4G LTE High-Speed Network | No VPN Required | Hotspot Allow| No-Contract for Unlocked Phones",34.19,22,,,,True,197,30일,30일,180일,unknown,lte_4g_only,"{""skt"": null, ""kt"": null, ""lgu"": null}",20GB,https://www.amazon.com/eSIM-20GB-Get-High-Speed-No-Contract/dp/B0GTM51CN4,B0GTM51CN4,B0GTM51CN4,STAR VENTURE,Brand: ＵＲＯＺＥＴＴＡ,"{""price_usd"": [""$34.19""], ""usage_validity"": [""Prepaid eSIM for Mainland China, Hong Kong, Macau, Taiwan | 20GB 30Day Plan Data | Get QR Code Instantly | 4G LTE High-Speed Network | No VPN Required | Hotspot Allow| No-Contract ""], ""activation_validity"": [""KiwiSIM USA Data SIM Card 12GB 180 Days, 4G LTE SIM Card Support for AT&T, T-Mobile and Verizon, Nano Card for Unlocked Cellular Security Cameras/Router/Hotspot WiFi/Trail Camera (""], ""data_amount"": [""20GB 30-Day Prepaid eSIM: Enjoy a 30-day plan with 20GB of 5G/4G LTE high-speed coverage across Mainland China, Hong Kong, Macau, and Taiwan. Perfect for travelers and business pro""], ""network_type"": [""insufficient_or_conflicting_signals(local=0, roaming=-2)""], ""network_generation"": [""product_info_cellular_4g_lte: source:product_info_cellular: Cellular Technology LTE"", ""product_info_cellular_4g_lte: source:product_info_cellular: Cellular Technology LTE""], ""review_count"": [""detail_page: 22""], ""is_bestseller"": [""Best Sellers Rank #85,089 in Cell Phones & Accessories ( See Top 100 in Cell Phones & Accessories ) #197 in Cell Phone SIM Cards""], ""bestseller_rank"": [""Best Sellers Rank #85,089 in Cell Phones & Accessories ( See Top 100 in Cell Phones & Accessories ) #197 in Cell Phone SIM Cards""], ""title"": [""Prepaid eSIM for Mainland China, Hong Kong, Macau, Taiwan | 20GB 30Day Plan Data | Get QR Code Instantly | 4G LTE High-Speed Network | No VPN Required | Hotspot Allow| No-Contract for Unlocked Phones""]}"
amazon_us,kr,"North America Data SIM Card – 7 Days 10GB 5G/4G/LTE for USA Canada Mexico, Easy to Use, 3-in-1 SIM, Data Only No Phone Number, No Contract, for Tourists & Fans",28.39,5,,,,True,209,7일,7일,180일,unknown,5g_capable,"{""skt"": null, ""kt"": null, ""lgu"": null}",10GB,https://www.amazon.com/North-America-Data-SIM-Card/dp/B0GV43B87B,B0GV43B87B,B0GV43B87B,YCTEL,Visit the YCTEL Store,"{""price_usd"": [""$28.39""], ""usage_validity"": [""North America Data SIM Card – 7 Days 10GB 5G/4G/LTE for USA Canada Mexico, Easy to Use, 3-in-1 SIM, Data Only No Phone Number, No Contract, for Tourists & Fans""], ""activation_validity"": [""KiwiSIM USA Data SIM Card 12GB 180 Days, 4G LTE SIM Card Support for AT&T, T-Mobile and Verizon, Nano Card for Unlocked Cellular Security Cameras/Router/Hotspot WiFi/Trail Camera (""], ""data_amount"": [""Amazon.com: North America Data SIM Card – 7 Days 10GB 5G/4G/LTE for USA Canada Mexico, Easy to Use, 3-in-1 SIM, Data Only No Phone Number, No Contract, for Tourists & Fans : Cell P""], ""network_type"": [""local_signal: Easy Setup: Upon arrival at your destination, insert your SIM card, and it will automatically identify the best local network. Activation is complete upon first insertion. Supports"", ""roaming_signal: Saved me from a massive roaming bill!"", ""insufficient_or_conflicting_signals(local=3, roaming=5)""], ""network_generation"": [""product_info_cellular_5g: source:product_info_cellular: Cellular Technology 4GLTE/5G"", ""product_info_cellular_5g: source:product_info_cellular: Cellular Technology 4GLTE/5G"", ""product_info_cellular_4g_lte_signal_present_but_5g_capable_takes_precedence""], ""review_count"": [""detail_page: 5 global ratings""], ""is_bestseller"": [""Best Sellers Rank #92,057 in Cell Phones & Accessories ( See Top 100 in Cell Phones & Accessories ) #209 in Cell Phone SIM Cards""], ""bestseller_rank"": [""Best Sellers Rank #92,057 in Cell Phones & Accessories ( See Top 100 in Cell Phones & Accessories ) #209 in Cell Phone SIM Cards""], ""title"": [""North America Data SIM Card – 7 Days 10GB 5G/4G/LTE for USA Canada Mexico, Easy to Use, 3-in-1 SIM, Data Only No Phone Number, No Contract, for Tourists & Fans""]}"
amazon_us,kr,Colombia 30-Day | 5GB Fixed Data eSIM,18.99,284,,,,True,251,30일,30일,30일,roaming,unknown,"{""skt"": null, ""kt"": null, ""lgu"": null}",5GB,https://www.amazon.com/Colombia-30-Day-5GB-Fixed-Data/dp/B0G87KGKDD,B0G87KGKDD,B0G87KGKDD,Jethro Trading Ltd.,Visit the JETSIM Store,"{""price_usd"": [""$18.99""], ""usage_validity"": [""Colombia 30-Day | 5GB Fixed Data eSIM""], ""activation_validity"": [""Product description Can I use my eSIM immediately after purchase? Yes. Simply submit the claim form, and we will deliver your eSIM to your email right away. Do I need to activate m""], ""data_amount"": [""[Fast & Reliable Data] 5GB high-speed + unlimited basic data for 30 days. Perfect for maps, apps, and staying connected in Colombia.""], ""network_type"": [""Product description Can I use my eSIM immediately after purchase? Yes. Simply submit the claim form, and we will deliver your eSIM to your email right away. Do I need to activate m"", ""score: local=0, roaming=3""], ""network_generation"": [""fallback_5g: source:meta_description: Amazon.com: Colombia 30-Day | 5GB Fixed Data eSIM : Cell Phones & Accessories"", ""fallback_4g_lte: source:image_alt: SIMPoYo 5G/4G High-Speed Data SIM Card |Free 10GB USA 30-Day Data"", ""fallback_only_network_generation_signal""], ""review_count"": [""detail_page: 284""], ""is_bestseller"": [""Best Sellers Rank #108,423 in Cell Phones & Accessories ( See Top 100 in Cell Phones & Accessories ) #251 in Cell Phone SIM Cards""], ""bestseller_rank"": [""Best Sellers Rank #108,423 in Cell Phones & Accessories ( See Top 100 in Cell Phones & Accessories ) #251 in Cell Phone SIM Cards""], ""title"": [""Colombia 30-Day | 5GB Fixed Data eSIM""]}"
amazon_us,kr,"V3 Flagship eSIM Card for Unlocked Android – SIM to eSIM Adapter, 50 Profiles + 1GB Free Data, STK Menu, Unlimited Downloads, Pre-Cut Nano/Micro/Standard, Global Travel in USA/Europe/Japan/China",34.99,175,,,50,True,16,150일,150일,180일,unknown,unknown,"{""skt"": null, ""kt"": null, ""lgu"": null}",1GB,https://www.amazon.com/9eSIM-Flagship-eSIM-Unlocked-Android/dp/B0DWSMSCT1,B0DWSMSCT1,B0DWSMSCT1,9esim Official Store,Visit the 9esim Store,"{""price_usd"": [""$34.99""], ""usage_validity"": [""KiwiSIM SIM Card Data Only 12GB 150Days,4G LTE US SIM Card for Unlocked Phone/Router/Security Camera,Support for AT&T,T-Mobile and Verizon,No Contract(Requires Activation)""], ""activation_validity"": [""KiwiSIM USA Data SIM Card 12GB 180 Days, 4G LTE SIM Card Support for AT&T, T-Mobile and Verizon, Nano Card for Unlocked Cellular Security Cameras/Router/Hotspot WiFi/Trail Camera (""], ""data_amount"": [""50 ESIM PROFILES–INDUSTRY HIGHEST + 1GB FREE DATA： This ultimate international travel eSIM card has 1.5MB ultra‑large storage for 50 eSIM profiles – more than any consumer eSIM car""], ""network_type"": [""roaming_signal: Product description IMPORTANT COMPATIBILITY NOTE For Android users: Most unlocked Android phones work directly with the 9eSIM card. Download the free 9eSIM App from Google Play. Wh"", ""insufficient_or_conflicting_signals(local=0, roaming=-1)""], ""network_generation"": [""fallback_5g: source:image_alt: EIOTCLUB SIM Card for Data Only, 5G/4G LTE USA Compatible with Nationwide Networks for Security, Hunting Trail Game Cameras - No Contract Wireless-Triple Cut Size"", ""fallback_4g_lte: source:image_alt: EIOTCLUB SIM Card for Data Only, 5G/4G LTE USA Compatible with Nationwide Networks for Security, Hunting Trail Game Cameras - No Contract Wireless-Triple Cut Size"", ""fallback_only_network_generation_signal""], ""monthly_sold_count"": [""search_result_fallback: 50""], ""review_count"": [""detail_page: 175 global ratings""], ""is_bestseller"": [""Best Sellers Rank #22,000 in Cell Phones & Accessories ( See Top 100 in Cell Phones & Accessories ) #16 in Cell Phone SIM Card Tools & Accessories #46 in Cell Phone SIM Cards""], ""bestseller_rank"": [""Best Sellers Rank #22,000 in Cell Phones & Accessories ( See Top 100 in Cell Phones & Accessories ) #16 in Cell Phone SIM Card Tools & Accessories #46 in Cell Phone SIM Cards""], ""title"": [""V3 Flagship eSIM Card for Unlocked Android – SIM to eSIM Adapter, 50 Profiles + 1GB Free Data, STK Menu, Unlimited Downloads, Pre-Cut Nano/Micro/Standard, Global Travel in USA/Europe/Japan/China""]}"
amazon_us,kr,"China Prepaid eSIM – 10GB High-Speed + Unlimited Basic Data | 30-Day Travel Data Plan | Instant Activation, No Registration Needed | Works with Google, Whatsapp, Maps & More | Digital SIM",15.19,1,,,,True,461,30일,30일,30일,unknown,5g_capable,"{""skt"": null, ""kt"": null, ""lgu"": null}",10GB,https://www.amazon.com/China-Prepaid-eSIM-High-Speed-Registration/dp/B0FDM6VWD6,B0FDM6VWD6,B0FDM6VWD6,Jethro Trading Ltd.,Visit the JETSIM Store,"{""price_usd"": [""$15.19""], ""usage_validity"": [""China Prepaid eSIM – 10GB High-Speed + Unlimited Basic Data | 30-Day Travel Data Plan | Instant Activation, No Registration Needed | Works with Google, Whatsapp, Maps & More | Digi""], ""activation_validity"": [""Product description Can I use my eSIM immediately after purchase? Yes. Simply submit the claim form, and we will deliver your eSIM to your email right away. Do I need to activate m""], ""data_amount"": [""[Fast & Reliable Data] 10GB high-speed + unlimited basic data for 30 days. Perfect for maps, apps, and staying connected in China.""], ""network_type"": [""roaming_signal: Product description Can I use my eSIM immediately after purchase? Yes. Simply submit the claim form, and we will deliver your eSIM to your email right away. Do I need to activate m"", ""insufficient_or_conflicting_signals(local=0, roaming=1)""], ""network_generation"": [""product_info_cellular_5g: source:product_info_cellular: Cellular Technology 5G/4G"", ""product_info_cellular_5g: source:product_info_cellular: Cellular Technology 5G/4G""], ""review_count"": [""detail_page: 1 global rating""], ""is_bestseller"": [""Best Sellers Rank #208,355 in Cell Phones & Accessories ( See Top 100 in Cell Phones & Accessories ) #461 in Cell Phone SIM Cards""], ""bestseller_rank"": [""Best Sellers Rank #208,355 in Cell Phones & Accessories ( See Top 100 in Cell Phones & Accessories ) #461 in Cell Phone SIM Cards""], ""title"": [""China Prepaid eSIM – 10GB High-Speed + Unlimited Basic Data | 30-Day Travel Data Plan | Instant Activation, No Registration Needed | Works with Google, Whatsapp, Maps & More | Digital SIM""]}"
amazon_us,kr,"Sim Card Unlimited Data with 30GB High-Speed, Works in 12 Asia-Pacific Countries for 30 Days Including Vietnam, Singapore, Malaysia, Indonesia, and Thailand",39.99,3,,,,True,254,30일,30일,30일,local,5g_capable,"{""skt"": null, ""kt"": null, ""lgu"": null}",1GB,https://www.amazon.com/Unlimited-High-Speed-Asia-Pacific-30-Days/dp/B0GT68DQLB,B0GT68DQLB,B0GT68DQLB,Jethro Trading Ltd.,Visit the JETSIM Store,"{""price_usd"": [""$39.99""], ""usage_validity"": [""Sim Card Unlimited Data with 30GB High-Speed, Works in 12 Asia-Pacific Countries for 30 Days Including Vietnam, Singapore, Malaysia, Indonesia, and Thailand""], ""activation_validity"": [""Product description How do I activate the SIM card? Once you receive your SIM card, simply complete the activation form and we will activate your plan. When you arrive at your dest""], ""data_amount"": [""[Fast & Reliable Data] 1GB high-speed daily + unlimited basic data for 30 days - ideal for maps, social media, and emails.""], ""network_type"": [""Product description How do I activate the SIM card? Once you receive your SIM card, simply complete the activation form and we will activate your plan. When you arrive at your dest"", ""score: local=3, roaming=-2""], ""network_generation"": [""product_info_cellular_5g: source:product_info_cellular: Cellular Technology 5G/4G"", ""product_info_cellular_5g: source:product_info_cellular: Cellular Technology 5G/4G""], ""review_count"": [""detail_page: 3 global ratings""], ""is_bestseller"": [""Best Sellers Rank #110,014 in Cell Phones & Accessories ( See Top 100 in Cell Phones & Accessories ) #254 in Cell Phone SIM Cards""], ""bestseller_rank"": [""Best Sellers Rank #110,014 in Cell Phones & Accessories ( See Top 100 in Cell Phones & Accessories ) #254 in Cell Phone SIM Cards""], ""title"": [""Sim Card Unlimited Data with 30GB High-Speed, Works in 12 Asia-Pacific Countries for 30 Days Including Vietnam, Singapore, Malaysia, Indonesia, and Thailand""]}"
amazon_us,kr,Japan Travel eSIM Card – 20 Day 10GB Prepaid Data Plan| 4G LTE High-Speed Data + Unlimited Slow Data | Hotspot Supported | Local Carrier | No Contract & SIM Card Needed | for Unlocked iOS & Android,18.04,53,,,,True,269,20일,20일,180일,local,lte_4g_only,"{""skt"": null, ""kt"": null, ""lgu"": null}",10GB,https://www.amazon.com/Prepaid-High-Speed-Network-Unlimited-Supported/dp/B0DW43TL4C,B0DW43TL4C,B0DW43TL4C,STAR VENTURE,Visit the generic Store,"{""price_usd"": [""$18.04""], ""usage_validity"": [""Japan Travel eSIM Card – 20 Day 10GB Prepaid Data Plan| 4G LTE High-Speed Data + Unlimited Slow Data | Hotspot Supported | Local Carrier | No Contract & SIM Card Needed | for Unloc""], ""activation_validity"": [""KiwiSIM USA Data SIM Card 12GB 180 Days, 4G LTE SIM Card Support for AT&T, T-Mobile and Verizon, Nano Card for Unlocked Cellular Security Cameras/Router/Hotspot WiFi/Trail Camera (""], ""data_amount"": [""10GB 20-days Japan eSIM: Enjoy a 20-day plan with 10GB of premium 4G LTE data on Japan's most reliable networks.Perfect for travelers and business professionals - supports mobile h""], ""network_type"": [""Japan Travel eSIM Card – 20 Day 10GB Prepaid Data Plan| 4G LTE High-Speed Data + Unlimited Slow Data | Hotspot Supported | Local Carrier | No Contract & SIM Card Needed | for Unloc"", ""Product description Previous page Next page 1 Fast eSIM Network 2 Apps Travel With You 3 Turn eSIM into WiFi 4 Snap QR, Get eSIM 5 Instant eSIM Activation Previous page Reliable 4G"", ""score: local=21, roaming=1""], ""network_generation"": [""product_info_cellular_4g_lte: source:product_info_cellular: Cellular Technology LTE"", ""product_info_cellular_4g_lte: source:product_info_cellular: Cellular Technology LTE""], ""review_count"": [""detail_page: 53 global ratings""], ""is_bestseller"": [""Best Sellers Rank #119,005 in Cell Phones & Accessories ( See Top 100 in Cell Phones & Accessories ) #269 in Cell Phone SIM Cards""], ""bestseller_rank"": [""Best Sellers Rank #119,005 in Cell Phones & Accessories ( See Top 100 in Cell Phones & Accessories ) #269 in Cell Phone SIM Cards""], ""title"": [""Japan Travel eSIM Card – 20 Day 10GB Prepaid Data Plan| 4G LTE High-Speed Data + Unlimited Slow Data | Hotspot Supported | Local Carrier | No Contract & SIM Card Needed | for Unlocked iOS & Android""]}"
amazon_us,kr,"[eSIM] Japan eSIM | 30DAYS 10GB | 5G, 4G/LTE, Tethering, Hotspot | SIM with Instant Activation in 10 Minutes | KDDI, SoftBank | Tokyo, Osaka, Fukuoka, Sapporo | Travel with Ringsim",9.99,10,,,,True,147,30일,30일,180일,local,5g_capable,"{""skt"": null, ""kt"": null, ""lgu"": null}",5GB,https://www.amazon.com/Tethering-Hotspot-Instant-Activation-SoftBank/dp/B0F2MQFCX2,B0F2MQFCX2,B0F2MQFCX2,RINGSIM,Visit the ringsim Store,"{""price_usd"": [""$9.99""], ""usage_validity"": [""[eSIM] Japan eSIM | 30DAYS 10GB | 5G, 4G/LTE, Tethering, Hotspot | SIM with Instant Activation in 10 Minutes | KDDI, SoftBank | Tokyo, Osaka, Fukuoka, Sapporo | Travel with Ringsim""], ""activation_validity"": [""KiwiSIM USA Data SIM Card 12GB 180 Days, 4G LTE SIM Card Support for AT&T, T-Mobile and Verizon, Nano Card for Unlocked Cellular Security Cameras/Router/Hotspot WiFi/Trail Camera (""], ""data_amount"": [""★ Flexible Data Plans: Pick 5GB, 10GB, 20GB, 30GB, or Unlimited—perfect for both casual browsing and heavy usage. Flexible prepaid options tailored to your trip in Japan.""], ""network_type"": [""Product description Previous page Next page 1 Why have to use eSIM 2 What is eSIM? 3 How to Create eSIM. STEP1 4 How to Create eSIM. STEP2 How to install eSIM in IOS(iPhone) Previo"", ""score: local=3, roaming=-2""], ""network_generation"": [""product_info_cellular_5g: source:product_info_cellular: Cellular Technology 5G, 4G, LTE"", ""product_info_cellular_5g: source:product_info_cellular: Cellular Technology 5G, 4G, LTE""], ""review_count"": [""detail_page: 10 global ratings""], ""is_bestseller"": [""Best Sellers Rank #61,055 in Cell Phones & Accessories ( See Top 100 in Cell Phones & Accessories ) #147 in Cell Phone SIM Cards""], ""bestseller_rank"": [""Best Sellers Rank #61,055 in Cell Phones & Accessories ( See Top 100 in Cell Phones & Accessories ) #147 in Cell Phone SIM Cards""], ""title"": [""[eSIM] Japan eSIM | 30DAYS 10GB | 5G, 4G/LTE, Tethering, Hotspot | SIM with Instant Activation in 10 Minutes | KDDI, SoftBank | Tokyo, Osaka, Fukuoka, Sapporo | Travel with Ringsim""]}"
amazon_us,kr,"Prepaid eSIM for Mainland China, Hong Kong, Macau, Taiwan | 5GB 7Day Plan Data | Get QR Code Instantly | 4G LTE High-Speed Network | No VPN Required | Hotspot Allow| No-Contract for Unlocked Phones",9.99,8,,,,True,243,7일,7일,180일,local,lte_4g_only,"{""skt"": null, ""kt"": null, ""lgu"": null}",5GB,https://www.amazon.com/5GB-Mainland-High-Speed-Activation-No-Contract/dp/B0DR8XYVPG,B0DR8XYVPG,B0DR8XYVPG,STAR VENTURE,Visit the UROZETTA Store,"{""price_usd"": [""$9.99""], ""usage_validity"": [""Prepaid eSIM for Mainland China, Hong Kong, Macau, Taiwan | 5GB 7Day Plan Data | Get QR Code Instantly | 4G LTE High-Speed Network | No VPN Required | Hotspot Allow| No-Contract fo""], ""activation_validity"": [""KiwiSIM USA Data SIM Card 12GB 180 Days, 4G LTE SIM Card Support for AT&T, T-Mobile and Verizon, Nano Card for Unlocked Cellular Security Cameras/Router/Hotspot WiFi/Trail Camera (""], ""data_amount"": [""5GB 7-Day Prepaid eSIM: Enjoy a 7-day plan with 5GB of 5G/4G LTE high-speed coverage across Mainland China, Hong Kong, Macau, and Taiwan. Perfect for travelers and business profess""], ""network_type"": [""Product description Previous page Next page 1 Fast eSIM Network 2 Apps Travel With You 3 Turn eSIM into WiFi 4 Snap QR, Get eSIM 5 Instant eSIM Activation Previous page Reliable 4G"", ""score: local=3, roaming=1""], ""network_generation"": [""product_info_cellular_4g_lte: source:product_info_cellular: Cellular Technology LTE"", ""product_info_cellular_4g_lte: source:product_info_cellular: Cellular Technology LTE""], ""review_count"": [""detail_page: 8 global ratings""], ""is_bestseller"": [""Best Sellers Rank #105,350 in Cell Phones & Accessories ( See Top 100 in Cell Phones & Accessories ) #243 in Cell Phone SIM Cards""], ""bestseller_rank"": [""Best Sellers Rank #105,350 in Cell Phones & Accessories ( See Top 100 in Cell Phones & Accessories ) #243 in Cell Phone SIM Cards""], ""title"": [""Prepaid eSIM for Mainland China, Hong Kong, Macau, Taiwan | 5GB 7Day Plan Data | Get QR Code Instantly | 4G LTE High-Speed Network | No VPN Required | Hotspot Allow| No-Contract for Unlocked Phones""]}"
