site,country,title,price_usd,review_count,seller_badge,search_position,monthly_sold_count,is_bestseller,bestseller_rank,validity,usage_validity,activation_validity,network_type,network_generation,carrier_support_local,data_amount,product_url,asin,site_product_id,seller,brand,evidence
amazon_us,kr,Happy 5G South Korea 30 Days Unlimited Data Sim Card | 15GB of 5G High-Speed Data Then 128kbps | No Registration Required | Easy Activation,21.51,1,,,,True,486,30일,30일,180일,unknown,5g_capable,"{""skt"": true, ""kt"": null, ""lgu"": true}",unlimited,https://www.amazon.com/Unlimited-High-Speed-Registration-Required-Activation/dp/B0FHWCT6HX,B0FHWCT6HX,B0FHWCT6HX,HAPPY SIM,Visit the HAPPY TELECOM Store,"{""price_usd"": [""$21.51""], ""usage_validity"": [""Happy 5G South Korea 30 Days Unlimited Data Sim Card | 15GB of 5G High-Speed Data Then 128kbps | No Registration Required | Easy Activation""], ""activation_validity"": [""KiwiSIM USA Data SIM Card 12GB 180 Days, 4G LTE SIM Card Support for AT&T, T-Mobile and Verizon, Nano Card for Unlocked Cellular Security Cameras/Router/Hotspot WiFi/Trail Camera (""], ""data_amount"": [""▶ SKT/LGU (Korea) 3 in 1 sim card fits for most phones - plug and use, no registration is required- unlimited data service, after the usage reaches 15GB, service continues at a thr""], ""network_type"": [""local_signal: ▶ Turn on the roaming data & local data in order to use the data services, Ensure wifi is OFF at this moment; flight mode is OFF; network mode select 5G/4G LTE/3G/2G"", ""roaming_signal: ▶ Turn on the roaming data & local data in order to use the data services, Ensure wifi is OFF at this moment; flight mode is OFF; network mode select 5G/4G LTE/3G/2G"", ""insufficient_or_conflicting_signals(local=1, roaming=0)""], ""network_generation"": [""product_info_cellular_5g: source:product_info_cellular: Cellular Technology 5G"", ""product_info_cellular_5g: source:product_info_cellular: Cellular Technology 5G""], ""carrier_support_local"": [""SKT, LGU+: ▶ SKT/LGU (Korea) 3 in 1 sim card fits for most phones - plug and use, no registration is required- unlimited data service, after the usage reaches 15""], ""review_count"": [""detail_page: 1 global rating""], ""is_bestseller"": [""Best Sellers Rank #218,654 in Cell Phones & Accessories ( See Top 100 in Cell Phones & Accessories ) #486 in Cell Phone SIM Cards""], ""bestseller_rank"": [""Best Sellers Rank #218,654 in Cell Phones & Accessories ( See Top 100 in Cell Phones & Accessories ) #486 in Cell Phone SIM Cards""], ""title"": [""Happy 5G South Korea 30 Days Unlimited Data Sim Card | 15GB of 5G High-Speed Data Then 128kbps | No Registration Required | Easy Activation""]}"
amazon_us,kr,"TSIM South America eSIM 30 Day | 12 GB Internet in 5G/4G/LTE (Data Sharing Allowed) | Use in Brazil, Chile, Colombia, Peru, Uruguay & Costa Rica | eSIM in 24 Hours | High Coverage 5G Network.",24.89,15,,,,True,138,1일,1일,30일,unknown,lte_4g_only,"{""skt"": null, ""kt"": null, ""lgu"": null}",12GB,https://www.amazon.com/TSIM-eSIM-30-Day-Internet/dp/B0GWRNXXKY,B0GWRNXXKY,B0GWRNXXKY,TSIM Cards,Visit the TSIM Store,"{""price_usd"": [""$24.89""], ""usage_validity"": [""GET YOUR eSIM IN 24 HOURS: 24 hours after ordering, go to tsim.mobi/activate enter your Amazon order ID and follow the instructions to schedule the immediate or later activation of""], ""activation_validity"": [""TSIM South America eSIM 30 Day | 12 GB Internet in 5G/4G/LTE (Data Sharing Allowed) | Use in Brazil, Chile, Colombia, Peru, Uruguay & Costa Rica | eSIM in 24 Hours | High Coverage ""], ""data_amount"": [""30 Days 12GB High-Speed Data: Enjoy 30 Days of seamless connectivity in South America with 6GB of high-speed 4G/5G data, perfect for browsing, streaming, and navigation on the go. ""], ""network_type"": [""no_local_or_roaming_keyword_matched""], ""network_generation"": [""product_info_cellular_4g_lte: source:product_info_cellular: Cellular Technology LTE"", ""product_info_cellular_4g_lte: source:product_info_cellular: Cellular Technology LTE""], ""review_count"": [""detail_page: 15 global ratings""], ""is_bestseller"": [""Best Sellers Rank #58,466 in Cell Phones & Accessories ( See Top 100 in Cell Phones & Accessories ) #138 in Cell Phone SIM Cards""], ""bestseller_rank"": [""Best Sellers Rank #58,466 in Cell Phones & Accessories ( See Top 100 in Cell Phones & Accessories ) #138 in Cell Phone SIM Cards""], ""title"": [""TSIM South America eSIM 30 Day | 12 GB Internet in 5G/4G/LTE (Data Sharing Allowed) | Use in Brazil, Chile, Colombia, Peru, Uruguay & Costa Rica | eSIM in 24 Hours | High Coverage 5G Network.""]}"
amazon_us,kr,Orange Holiday Europe Prepaid eSIM 20GB Internet Data | 30 Days-Use | Data tethering Allowed | 30min & 200 SMS from Europe to Any Country Worldwide,21.95,126,,,,True,9,14일,14일,30일,unknown,5g_capable,"{""skt"": null, ""kt"": null, ""lgu"": null}",20GB,https://www.amazon.com/eSIM-12GB-Internet-tethering-Worldwide/dp/B0BXP4L87V,B0BXP4L87V,B0BXP4L87V,USBelieve Direct,Visit the ROAMING SAVER Store,"{""price_usd"": [""$21.95""], ""usage_validity"": [""Plan Detail: 20GB Internet in Europe on 5G/4G LTE HIGH-Speed networks - Mobile hotspot tethering is supported. 30mins of international calls and 200 texts from Europe to worldwide.""], ""activation_validity"": [""Orange Holiday Europe Prepaid eSIM 20GB Internet Data | 30 Days-Use | Data tethering Allowed | 30min & 200 SMS from Europe to Any Country Worldwide""], ""data_amount"": [""20GB Internet in Europe on 5G/4G LTE HIGH Speed networks - Data tethering and hotspot supported.""], ""network_type"": [""local_signal: Plan Detail: 20GB Internet in Europe on 5G/4G LTE HIGH-Speed networks - Mobile hotspot tethering is supported. 30mins of international calls and 200 texts from Europe to worldwide."", ""roaming_signal: Plan Detail: 20GB Internet in Europe on 5G/4G LTE HIGH-Speed networks - Mobile hotspot tethering is supported. 30mins of international calls and 200 texts from Europe to worldwide."", ""insufficient_or_conflicting_signals(local=6, roaming=6)""], ""network_generation"": [""product_info_cellular_5g: source:product_info_cellular: Cellular Technology 5G, 4G LTE"", ""product_info_cellular_5g: source:product_info_cellular: Cellular Technology 5G, 4G LTE""], ""review_count"": [""detail_page: 126 global ratings""], ""is_bestseller"": [""Best Sellers Rank #7,074 in Cell Phones & Accessories ( See Top 100 in Cell Phones & Accessories ) #9 in Cell Phone SIM Cards""], ""bestseller_rank"": [""Best Sellers Rank #7,074 in Cell Phones & Accessories ( See Top 100 in Cell Phones & Accessories ) #9 in Cell Phone SIM Cards""], ""title"": [""Orange Holiday Europe Prepaid eSIM 20GB Internet Data | 30 Days-Use | Data tethering Allowed | 30min & 200 SMS from Europe to Any Country Worldwide""]}"
amazon_us,kr,"Nordic eSIM 30 Days 20GB High-Speed Data + Unlimited Basic Data for France, UK, Germany, Finland, Sweden | Instant QR Code Delivery | Travel eSIM for Unlocked iPhones & Adroids",28.49,1,,,,True,450,30일,30일,30일,local,5g_capable,"{""skt"": null, ""kt"": null, ""lgu"": null}",20GB,https://www.amazon.com/30-Days-High-Speed-Unlimited-Delivery/dp/B0F934MR9G,B0F934MR9G,B0F934MR9G,Jethro Trading Ltd.,Visit the JETSIM Store,"{""price_usd"": [""$28.49""], ""usage_validity"": [""Nordic eSIM 30 Days 20GB High-Speed Data + Unlimited Basic Data for France, UK, Germany, Finland, Sweden | Instant QR Code Delivery | Travel eSIM for Unlocked iPhones & Adroids""], ""activation_validity"": [""Product description Can I use my eSIM immediately after purchase? Yes. Simply submit the claim form, and we will deliver your eSIM to your email right away. Do I need to activate m""], ""data_amount"": [""[Fast & Reliable Data] 20GB at high-speed + unlimited basic data for 30 days - ideal for maps, social media, and emails.""], ""network_type"": [""[Instant Activation] Connects automatically with local carriers when you arrive in Finland, Denmark, Norway, Sweden, Iceland, United Kingdom, France, Germany. No SIM swapping, no s"", ""score: local=3, roaming=1""], ""network_generation"": [""product_info_cellular_5g: source:product_info_cellular: Cellular Technology 5G/4G"", ""product_info_cellular_5g: source:product_info_cellular: Cellular Technology 5G/4G""], ""review_count"": [""detail_page: 1 global rating""], ""is_bestseller"": [""Best Sellers Rank #201,360 in Cell Phones & Accessories ( See Top 100 in Cell Phones & Accessories ) #450 in Cell Phone SIM Cards""], ""bestseller_rank"": [""Best Sellers Rank #201,360 in Cell Phones & Accessories ( See Top 100 in Cell Phones & Accessories ) #450 in Cell Phone SIM Cards""], ""title"": [""Nordic eSIM 30 Days 20GB High-Speed Data + Unlimited Basic Data for France, UK, Germany, Finland, Sweden | Instant QR Code Delivery | Travel eSIM for Unlocked iPhones & Adroids""]}"
amazon_us,kr,"EIOTCLUB eSIM Card & Reader Bundle - Physical eSIM Adapter for Unlocked Android/iPhone/Router, Unlimited Downloads, Global Travel (USA/Europe/200+ Countries), Windows & macOS Support",24.9,55,,,100,True,18,30일,30일,180일,unknown,unknown,"{""skt"": null, ""kt"": null, ""lgu"": null}",unlimited,https://www.amazon.com/EIOTCLUB-eSIM-Card-Reader-Bundle/dp/B0DLNBXCCW,B0DLNBXCCW,B0DLNBXCCW,hilan IoT,Visit the EIOTCLUB Store,"{""price_usd"": [""$24.90""], ""usage_validity"": [""EIOTCLUB Triple Play Pro SIM Card, 5GB 30-Day, 5G LTE Data, Nano Size only | Industrial-grade for robots, drones and cameras,""], ""activation_validity"": [""KiwiSIM USA Data SIM Card 12GB 180 Days, 4G LTE SIM Card Support for AT&T, T-Mobile and Verizon, Nano Card for Unlocked Cellular Security Cameras/Router/Hotspot WiFi/Trail Camera (""], ""data_amount"": [""Unlimited eSIM Downloads & Management: The EIOTCLUB eSIM adapter comes pre-installed with 1GB of free U.S. data and 100MB of global data, allowing unlimited downloads and deletions""], ""network_type"": [""no_local_or_roaming_keyword_matched""], ""network_generation"": [""fallback_5g: source:image_alt: EIOTCLUB Triple Play Pro SIM Card, 5GB 30-Day, 5G LTE Data, Nano Size only | Industrial-grade for robots, drones and cameras,"", ""fallback_4g_lte: source:image_alt: EIOTCLUB Triple Play Pro SIM Card, 5GB 30-Day, 5G LTE Data, Nano Size only | Industrial-grade for robots, drones and cameras,"", ""fallback_only_network_generation_signal""], ""monthly_sold_count"": [""search_result_fallback: 100""], ""review_count"": [""detail_page: 55 global ratings""], ""is_bestseller"": [""Best Sellers Rank #22,400 in Cell Phones & Accessories ( See Top 100 in Cell Phones & Accessories ) #18 in Cell Phone SIM Card Tools & Accessories""], ""bestseller_rank"": [""Best Sellers Rank #22,400 in Cell Phones & Accessories ( See Top 100 in Cell Phones & Accessories ) #18 in Cell Phone SIM Card Tools & Accessories""], ""title"": [""EIOTCLUB eSIM Card & Reader Bundle - Physical eSIM Adapter for Unlocked Android/iPhone/Router, Unlimited Downloads, Global Travel (USA/Europe/200+ Countries), Windows & macOS Support""]}"
amazon_us,kr,"International eSIM - Orange Holiday World - 30 Days, Upto 20GB Data, 15Minutes Calls, 50 Text/SMS. Preloaded & Preactivated with Worldwide Service. Tethering Allowed. Global eSIM for iPhone & Android",34.99,13,,,,True,337,30일,30일,30일,local,5g_capable,"{""skt"": null, ""kt"": null, ""lgu"": null}",20GB,https://www.amazon.com/International-eSIM-15Minutes-Preloaded-Preactivated/dp/B0FD4582JJ,B0FD4582JJ,B0FD4582JJ,TSIM Cards,Visit the TSIM Store,"{""price_usd"": [""$34.99""], ""usage_validity"": [""International eSIM - Orange Holiday World - 30 Days, Upto 20GB Data, 15Minutes Calls, 50 Text/SMS. Preloaded & Preactivated with Worldwide Service. Tethering Allowed. Global eSIM f""], ""activation_validity"": [""Amazon.com: International eSIM - Orange Holiday World - 30 Days, Upto 20GB Data, 15Minutes Calls, 50 Text/SMS. Preloaded & Preactivated with Worldwide Service. Tethering Allowed. G""], ""data_amount"": [""WORLDWIDE DATA: Up to 20GB of 5G/4G Data across the Globe including remote islands. Be connected everywhere! Data tethering allowed. No usage limitation (videos, apps)""], ""network_type"": [""AUTO ACTIVATING: Validity 30 days from 1st use (1st internet connection). High coverage multi-operator plan: SIM connects automatically to the best local network. Usable on any dev"", ""TSIM Prepaid USA SIM Card for Travel | Unlimited High Data, Unlimited Local Calls and Text for 30..."", ""score: local=5, roaming=-2""], ""network_generation"": [""product_info_cellular_5g: source:product_info_cellular: Cellular Technology 5G"", ""product_info_cellular_5g: source:product_info_cellular: Cellular Technology 5G""], ""review_count"": [""detail_page: 13 global ratings""], ""is_bestseller"": [""Best Sellers Rank #148,179 in Cell Phones & Accessories ( See Top 100 in Cell Phones & Accessories ) #337 in Cell Phone SIM Cards""], ""bestseller_rank"": [""Best Sellers Rank #148,179 in Cell Phones & Accessories ( See Top 100 in Cell Phones & Accessories ) #337 in Cell Phone SIM Cards""], ""title"": [""International eSIM - Orange Holiday World - 30 Days, Upto 20GB Data, 15Minutes Calls, 50 Text/SMS. Preloaded & Preactivated with Worldwide Service. Tethering Allowed. Global eSIM for iPhone & Android""]}"
amazon_us,kr,"TSIM South America eSIM 30 Day-10GB | Multi-Operator 5G/4G Network (Hotspot Allowed) | Use in Brazil, Chile, Colombia, Argentina, Costa Rica, Ecuador & More | eSIM in 24 Hours | Auto-Activating.",28.89,1,,,,True,265,1일,1일,30일,unknown,lte_4g_only,"{""skt"": null, ""kt"": null, ""lgu"": null}",10GB,https://www.amazon.com/TSIM-South-America-eSIM-Auto-Activating/dp/B0G5972LHF,B0G5972LHF,B0G5972LHF,TSIM Cards,Visit the TSIM Store,"{""price_usd"": [""$28.89""], ""usage_validity"": [""30 Days 10GB eSIM for Travel to South America. High-Speed Data Hotspot / Tethering: Allowed Data Only: Use VoIP apps like WhatsApp, Skype, or FaceTime for calls and messages Suppor""], ""activation_validity"": [""TSIM South America eSIM 30 Day-10GB | Multi-Operator 5G/4G Network (Hotspot Allowed) | Use in Brazil, Chile, Colombia, Argentina, Costa Rica, Ecuador & More | eSIM in 24 Hours | Au""], ""data_amount"": [""MULTI-OPERATOR 5G/4G NETWORK: eSIM automatically connects to multiple major South American carriers and switches networks for the best coverage, even in remote areas. Includes 10GB""], ""network_type"": [""local_signal: TSIM Prepaid USA SIM Card for Travel | Unlimited High Data, Unlimited Local Calls and Text for 30..."", ""roaming_signal: AUTO ACTIVATION: Your eSIM's validity begins only when you first connect to a network in South America, making it safe to install before your trip. Be sure to enable data roaming w"", ""insufficient_or_conflicting_signals(local=2, roaming=3)""], ""network_generation"": [""product_info_cellular_4g_lte: source:product_info_cellular: Cellular Technology LTE"", ""product_info_cellular_4g_lte: source:product_info_cellular: Cellular Technology LTE""], ""review_count"": [""detail_page: 1 global rating""], ""is_bestseller"": [""Best Sellers Rank #116,360 in Cell Phones & Accessories ( See Top 100 in Cell Phones & Accessories ) #265 in Cell Phone SIM Cards""], ""bestseller_rank"": [""Best Sellers Rank #116,360 in Cell Phones & Accessories ( See Top 100 in Cell Phones & Accessories ) #265 in Cell Phone SIM Cards""], ""title"": [""TSIM South America eSIM 30 Day-10GB | Multi-Operator 5G/4G Network (Hotspot Allowed) | Use in Brazil, Chile, Colombia, Argentina, Costa Rica, Ecuador & More | eSIM in 24 Hours | Auto-Activating.""]}"
amazon_us,kr,"Australia & New Zealand eSIM (10 Days), 8GB High-Speed Data, Quick Activating with QR Code, No Shipping or SIM Card Needed, Hotspot Support, Easy to Use Travel eSIM",21.84,1,,,,True,897,10일,10일,30일,roaming,5g_capable,"{""skt"": null, ""kt"": null, ""lgu"": null}",8GB,https://www.amazon.com/Australia-Zealand-High-Speed-Activating-Shipping/dp/B0FWH57Q3V,B0FWH57Q3V,B0FWH57Q3V,Jethro Trading Ltd.,Visit the JETSIM Store,"{""price_usd"": [""$21.84""], ""usage_validity"": [""Australia & New Zealand eSIM (10 Days), 8GB High-Speed Data, Quick Activating with QR Code, No Shipping or SIM Card Needed, Hotspot Support, Easy to Use Travel eSIM""], ""activation_validity"": [""Product description Can I use my eSIM immediately after purchase? Yes. Simply submit the claim form, and we will deliver your eSIM to your email right away. Do I need to activate m""], ""data_amount"": [""[Fast & Reliable Data] 8GB at high-speed + unlimited basic data for 10 days - ideal for maps, social media, and emails.""], ""network_type"": [""Product description Can I use my eSIM immediately after purchase? Yes. Simply submit the claim form, and we will deliver your eSIM to your email right away. Do I need to activate m"", ""score: local=0, roaming=3""], ""network_generation"": [""product_info_cellular_5g: source:product_info_cellular: Cellular Technology 5G/4G"", ""product_info_cellular_5g: source:product_info_cellular: Cellular Technology 5G/4G""], ""review_count"": [""detail_page: 1 global rating""], ""is_bestseller"": [""Best Sellers Rank #420,799 in Cell Phones & Accessories ( See Top 100 in Cell Phones & Accessories ) #897 in Cell Phone SIM Cards""], ""bestseller_rank"": [""Best Sellers Rank #420,799 in Cell Phones & Accessories ( See Top 100 in Cell Phones & Accessories ) #897 in Cell Phone SIM Cards""], ""title"": [""Australia & New Zealand eSIM (10 Days), 8GB High-Speed Data, Quick Activating with QR Code, No Shipping or SIM Card Needed, Hotspot Support, Easy to Use Travel eSIM""]}"
amazon_us,kr,"Latin America eSIM 30 Days 3GB High-Speed Data + Unlimited Basic Data for Peru, Brazil, Mexico, Colombia, & More| Instant QR Code Delivery | Travel eSIM for Unlocked iPhones & Adroids",25.64,249,,,,True,1160,30일,30일,30일,local,5g_capable,"{""skt"": null, ""kt"": null, ""lgu"": null}",3GB,https://www.amazon.com/30-3GB-High-Speed-Unlimited-Colombia/dp/B0GM2NSX64,B0GM2NSX64,B0GM2NSX64,Jethro Trading Ltd.,Visit the JETSIM Store,"{""price_usd"": [""$25.64""], ""usage_validity"": [""Latin America eSIM 30 Days 3GB High-Speed Data + Unlimited Basic Data for Peru, Brazil, Mexico, Colombia, & More| Instant QR Code Delivery | Travel eSIM for Unlocked iPhones & Adro""], ""activation_validity"": [""Product description Can I use my eSIM immediately after purchase? Yes. Simply submit the claim form, and we will deliver your eSIM to your email right away. Do I need to activate m""], ""data_amount"": [""[Fast & Reliable Data] 3GB at high-speed + unlimited basic data for 30 days - ideal for maps, social media, and emails.""], ""network_type"": [""[Instant Activation] Connects automatically with local carriers when you arrive in Argentina, Bolivia, Brazil, Chile, Colombia, Costa Rica, Ecuador, El Salvador, Guatemala, Hondura"", ""score: local=3, roaming=1""], ""network_generation"": [""product_info_cellular_5g: source:product_info_cellular: Cellular Technology 5G/4G"", ""product_info_cellular_5g: source:product_info_cellular: Cellular Technology 5G/4G""], ""review_count"": [""detail_page: 249""], ""is_bestseller"": [""Best Sellers Rank #611,223 in Cell Phones & Accessories ( See Top 100 in Cell Phones & Accessories ) #1,160 in Cell Phone SIM Cards""], ""bestseller_rank"": [""Best Sellers Rank #611,223 in Cell Phones & Accessories ( See Top 100 in Cell Phones & Accessories ) #1,160 in Cell Phone SIM Cards""], ""title"": [""Latin America eSIM 30 Days 3GB High-Speed Data + Unlimited Basic Data for Peru, Brazil, Mexico, Colombia, & More| Instant QR Code Delivery | Travel eSIM for Unlocked iPhones & Adroids""]}"
amazon_us,kr,Thailand eSIM | 10GB Super Saver Refillable Plan! QR Code Sent via Email in 24Hrs - Scan & Use Immediately | Auto Activating 15 Day Validity | 5G Speed + Hotspot | Data-Only No Phone Number,13.99,2,,,,True,201,15일,15일,,unknown,lte_4g_only,"{""skt"": null, ""kt"": null, ""lgu"": null}",10GB,https://www.amazon.com/Thailand-eSIM-10GB-Super-Refillable/dp/B0DX6P2CMT,B0DX6P2CMT,B0DX6P2CMT,TSIM Cards,Visit the TSIM Store,"{""price_usd"": [""$13.99""], ""usage_validity"": [""Thailand eSIM | 10GB Super Saver Refillable Plan! QR Code Sent via Email in 24Hrs - Scan & Use Immediately | Auto Activating 15 Day Validity | 5G Speed + Hotspot | Data-Only No Pho""], ""data_amount"": [""HIGH SPEED 5G/4G DATA: Enjoy up to 10GB of high-speed 5G/4G internet. Hotspot tethering is supported.""], ""network_type"": [""local_signal: Europe eSIM 30 Days 20GB + Unlimited Local Calls + 30 Min Call Home | eSIM Available in 24 Hours | 48 Countries | 5G Data + H"", ""insufficient_or_conflicting_signals(local=1, roaming=0)""], ""network_generation"": [""product_info_cellular_4g_lte: source:product_info_cellular: Cellular Technology LTE"", ""product_info_cellular_4g_lte: source:product_info_cellular: Cellular Technology LTE""], ""review_count"": [""detail_page: 2 global ratings""], ""is_bestseller"": [""Best Sellers Rank #86,741 in Cell Phones & Accessories ( See Top 100 in Cell Phones & Accessories ) #201 in Cell Phone SIM Cards""], ""bestseller_rank"": [""Best Sellers Rank #86,741 in Cell Phones & Accessories ( See Top 100 in Cell Phones & Accessories ) #201 in Cell Phone SIM Cards""], ""title"": [""Thailand eSIM | 10GB Super Saver Refillable Plan! QR Code Sent via Email in 24Hrs - Scan & Use Immediately | Auto Activating 15 Day Validity | 5G Speed + Hotspot | Data-Only No Phone Number""]}"
amazon_us,kr,"International Data SIM & eSIM Card Unlimited 2GB 7Days SIM and 600MB, 5G/4G 51 Countries in USA,UK,Europe,Asia,Oceania, for Unlocked WiFi Mobile Hotspot, Phones and Tablet–No Contract",4.99,6,,,,True,160,7일,7일,7일,local,lte_4g_only,"{""skt"": null, ""kt"": null, ""lgu"": null}",2GB,https://www.amazon.com/International-eSIM-Combo-Unlimited-2GB-600MB/dp/B0F8PW1B4G,B0F8PW1B4G,B0F8PW1B4G,TalkSimTech,Visit the TALKSIM Store,"{""price_usd"": [""$4.99""], ""usage_validity"": [""International Data SIM & eSIM Card Unlimited 2GB 7Days SIM and 600MB, 5G/4G 51 Countries in USA,UK,Europe,Asia,Oceania, for Unlocked WiFi Mobile Hotspot, Phones and Tablet–No Contr""], ""activation_validity"": [""【Flexible Top-Up Data Plans】This 7-day 2GB unlimited data-only SIM card (after 256Kbps) And eSIM 600MB deliver 5G/4G LTE high speed—perfect for non-stop navigation, social media, a""], ""data_amount"": [""【Dual SIM & eSIM Combo– Global Connectivity in One Card】One Pack, Two Ways to Connect. Includes both an international SIM card (2GB/7 days) and a travel eSIM (600MB trial) for maxi""], ""network_type"": [""【Dual SIM & eSIM Combo– Global Connectivity in One Card】One Pack, Two Ways to Connect. Includes both an international SIM card (2GB/7 days) and a travel eSIM (600MB trial) for maxi"", ""【Experience SeamlessaT&T and Verizon in the USA, Orange/Vodafone/Telefonica in Europe, and other countries carriers. Powered by intelligent auto-connect technology, it seamlessly s"", ""score: local=6, roaming=1""], ""network_generation"": [""product_info_cellular_4g_lte: source:product_info_cellular: Cellular Technology LTE"", ""product_info_cellular_4g_lte: source:product_info_cellular: Cellular Technology LTE""], ""review_count"": [""detail_page: 6 global ratings""], ""is_bestseller"": [""Best Sellers Rank #68,177 in Cell Phones & Accessories ( See Top 100 in Cell Phones & Accessories ) #160 in Cell Phone SIM Cards""], ""bestseller_rank"": [""Best Sellers Rank #68,177 in Cell Phones & Accessories ( See Top 100 in Cell Phones & Accessories ) #160 in Cell Phone SIM Cards""], ""title"": [""International Data SIM & eSIM Card Unlimited 2GB 7Days SIM and 600MB, 5G/4G 51 Countries in USA,UK,Europe,Asia,Oceania, for Unlocked WiFi Mobile Hotspot, Phones and Tablet–No Contract""]}"
amazon_us,kr,eSIM for Europe Travel 30 Day 5GB for 36 Countries | Refillable Super Economy Pack | Get eSIM in 24 Hours | High Coverage Multi-Operator 5G Network | Auto-Activating | Hotspot Allowed | Data Only,9.99,25,,,,True,175,30일,30일,180일,local,5g_capable,"{""skt"": null, ""kt"": null, ""lgu"": null}",5GB,https://www.amazon.com/eSIM-Day-5GB-Multi-Operator-Auto-Activating/dp/B0DW98KP84,B0DW98KP84,B0DW98KP84,TSIM Cards,Visit the TSIM Store,"{""price_usd"": [""$9.99""], ""usage_validity"": [""eSIM for Europe Travel 30 Day 5GB for 36 Countries | Refillable Super Economy Pack | Get eSIM in 24 Hours | High Coverage Multi-Operator 5G Network | Auto-Activating | Hotspot Allo""], ""activation_validity"": [""KiwiSIM USA Data SIM Card 12GB 180 Days, 4G LTE SIM Card Support for AT&T, T-Mobile and Verizon, Nano Card for Unlocked Cellular Security Cameras/Router/Hotspot WiFi/Trail Camera (""], ""data_amount"": [""Europe eSIM 30 Day 5GB. Get your eSIM in 24 Hours! Your eSIM QR Code is generated 24 hours after shipping begins. We make your eSIM QR code available in 3 ways: It is sent to your ""], ""network_type"": [""TSIM Prepaid USA SIM Card for Travel | Unlimited High Data, Unlimited Local Calls and Text for 30..."", ""TSIM Prepaid USA SIM Card for Travel | Unlimited High Data, Unlimited Local Calls and Text for 30..."", ""score: local=2, roaming=1""], ""network_generation"": [""product_info_cellular_5g: source:product_info_cellular: Cellular Technology 5G"", ""product_info_cellular_5g: source:product_info_cellular: Cellular Technology 5G""], ""review_count"": [""detail_page: 25 global ratings""], ""is_bestseller"": [""Best Sellers Rank #74,830 in Cell Phones & Accessories ( See Top 100 in Cell Phones & Accessories ) #175 in Cell Phone SIM Cards""], ""bestseller_rank"": [""Best Sellers Rank #74,830 in Cell Phones & Accessories ( See Top 100 in Cell Phones & Accessories ) #175 in Cell Phone SIM Cards""], ""title"": [""eSIM for Europe Travel 30 Day 5GB for 36 Countries | Refillable Super Economy Pack | Get eSIM in 24 Hours | High Coverage Multi-Operator 5G Network | Auto-Activating | Hotspot Allowed | Data Only""]}"
